Document ID,Page Count,Executive Summary
2013-E.C-Audit-finding-information,4,"Here is a summary of the audit finding document provided:\n\n**Overview**\nThis document is an **Audit Finding Annex (Annex 3)** regarding the **Ethiopian Investment Commission** for the budget year **2011** (Ethiopian Calendar). The audit was conducted by the Federal Auditor General Office.\n\n**Key Audit Findings**\nThe audit identified several deficiencies categorized into Expenditures, Revenue, and Liabilities. The primary cause for most findings was the failure to follow existing laws, regulations, and directives.\n\n**1. Expenditure Findings**\n*   **Low-Value Purchases (Procurement):** Purchases were made at higher prices than offered, failing to comply with procurement directives. This resulted in a loss of government funds.\n*   **Investment Purchases:** Expenses were incurred without proper competition, specifically regarding \ Guide\. This violated procurement performance directives and caused financial loss.\n*   **Budget Management:** The annual budget was paid out in a lump sum in advance, violating the Cash Management Directive. This prevents proper budget execution according to the plan.\n*   **Per Diem Payments:** Improper per diem payments were made, violating the \Duty Per Diem\ leading to government fund wastage.\n\n**2. Revenue Findings**\n*   **Collection Issues:** The collector failed to provide necessary documentation verifying the legitimacy of payments made by organizations or individuals. This failure to follow the Account Handling Directive prevented the government from collecting due revenue.\n\n**3. Liability Findings**\n*   **Unpaid Liabilities:** Payments owed to relevant bodies were not made on time. This failure to settle debts on time increases the institution's liabilities.\n\n**Auditor's Conclusion**\nDespite the listed findings, the auditor’s final report indicates that the financial statements were prepared in accordance with the approved budget and financial administration laws up to June 30, 2011. The reports confirm that revenue collected and budget expenditures generally followed the authorized financial administration laws and directives."
20191010_Pharmaceutical-Manufacturing-Opportunites-in-Ethiopia_VF,16,"Here is a summary of the document created by the Ethiopian Investment Commission regarding investment opportunities in Ethiopia:\n\n**Overview and Objectives**\nThe document outlines Ethiopia's strategy to attract Foreign Direct Investment (FDI) by coordinating with international partners and pitching manufacturing opportunities. The primary goal is to transform Ethiopia into a manufacturing hub in Africa by 2025.\n\n**Why Invest in Ethiopia?**\n*   **Economic Growth:** Ethiopia is one of the fastest-growing economies in Africa, averaging over 10% growth for the past decade.\n*   **Demographics:** The country boasts a productive labor force, with more than 60% of the population between the ages of 15 and 64.\n*   **Market Access:** Ethiopia offers access to the East African market and has strategic partnerships through COMESA and AGOA.\n\n**Strategic Sectors**\nThe government has identified several priority sectors for investment:\n*   Pharmaceuticals\n*   Textile and Garment\n*   Agro-processing\n*   Leather\n*   Floriculture\n*   Tourism and Energy\n\n**Focus on Pharmaceuticals**\n*   **Market Potential:** The pharmaceutical market is nascent but growing, projected to exceed $3.6 billion by 2030. It is currently growing at 15% per year.\n*   **Import Substitution:** Currently, 85-90% of pharmaceutical needs are imported, presenting a significant gap for local manufacturers to fill.\n*   **Drivers:** Demand is driven by a large population (\u003e100 million), rising healthcare coverage (100% primary coverage reached in 2015), and increasing prevalence of both communicable and non-communicable diseases.\n\n**Focus on Textile and Garment**\n*   **Resources:** There are over 2.7 million hectares of land suitable for cotton cultivation and reliable green energy at an estimated cost of $0.04 USD/kWh.\n*   **Industry Growth:** The industry has grown five-fold since 2008 and has attracted major global brands like PVH and H\u0026M.\n\n**Infrastructure: Kilinto Industrial Park**\n*   **Specialization:** This is the first industrial park specializing in pharmaceuticals.\n*   **Location:** Situated in Addis Ababa, 25 km from the city center and only 10 minutes from Bole International Airport.\n*   **Facilities:** The park covers 279 hectares and features a One-Stop Shop for services (permits, licenses, customs), dedicated waste treatment facilities, and 24/7 security.\n\n**Investment Incentives**\nThe government offers a proactive business environment with tailored fiscal and non-fiscal incentives:\n*   **Fiscal:** Income tax exemptions (up to 10-15 years for enterprises inside industrial parks), duty-free imports of machinery and construction materials, and tax loss carry-forward options.\n*   **Non-Fiscal:** Expedited visa procedures, guarantees against expropriation, and land lease options (60-80 years charge-free for developers).\n*   **Public Procurement:** A 25-30% price preference for domestically manufactured pharmaceuticals in public procurement."
CBE Annual Report 2012-13,21,"Here is a summary of the **Commercial Bank of Ethiopia (CBE) Annual Report for the 2012/13 Fiscal Year**:\n\n### **1. Financial Performance Overview**\nThe 2012/13 fiscal year was highly successful for CBE, marked by significant growth in income, assets, and profitability.\n*   **Profit:** The Bank achieved a gross (operating) profit of **8.6 billion Birr**, an increase of 7.9% over the previous year. Net profit reached approximately 5.9 billion Birr.\n*   **Income:** Total income rose to **13.7 billion Birr** (an 18.6% increase). This was largely driven by a 42.3% growth in interest income, specifically from loans and advances.\n*   **Expenses:** Total expenses increased by 41.8% to **5.2 billion Birr**, primarily due to a substantial rise in interest expenses (up 42.0%) following the expansion of the deposit base and branch network.\n*   **Balance Sheet:**\n    *   **Total Assets** grew by 23.0% to **195.4 billion Birr**.\n    *   **Total Deposits** surged by 28.7% to a record **154.4 billion Birr**.\n    *   **Capital and Reserves** increased from 7.6 billion Birr to **9.0 billion Birr**.\n*   **Non-Performing Loans (NPLs):** The NPL ratio remained low and stable at **2.2%**, well below the standard 5% threshold.\n\n### **2. Business Development \u0026 Operations**\nCBE focused heavily on expanding its accessibility and modernizing its services.\n*   **Branch Network:** The Bank opened **148 new branches**, bringing the total network to **695 branches** nationwide. This expansion was a key driver for deposit mobilization and customer acquisition.\n*   **Customer Base:** The number of account holders grew to **6.2 million**.\n*   **International Banking:** Income from foreign operations reached **4.0 billion Birr**. Foreign currency inflows totaled **$4.8 billion USD**, with private transfers growing by 35.2% due to partnerships with Western Union, MoneyGram, and Xpress Money.\n\n### **3. Technology \u0026 Modernization**\nThe Bank continued its transformation into a technology-driven institution:\n*   **Core Banking:** The T-24 Core Banking Solution was implemented in **305 branches** (200 added during this fiscal year).\n*   **Card Banking:** **300 ATMs** and 231 Point of Sale (POS) machines were deployed. The number of cardholders reached **300,470**.\n*   **Future Plans:** Modules for mobile and internet banking were finalized for roll-out. Plans were set to introduce interest-free banking and specialized savings schemes for youth and women in the next fiscal year.\n\n### **4. Human Resources**\n*   **Workforce:** The total number of employees reached **15,007** (a net addition of 2,235 staff).\n*   **Training:** Over 13,900 employees received technical and developmental training.\n*   **Strategy:** A comprehensive HR Development Strategy is being implemented, focusing on succession planning, performance management, and staff retention.\n\n### **5. Macroeconomic Context**\n*   **Ethiopian Economy:** The domestic economy grew by **8.5%**, a strong performance compared to the Sub-Saharan African average of 5.3%.\n*   **Inflation:** Successfully reduced to single digits (**7.4%** in June 2013, down from 20.8% in June 2012).\n*   **Global Economy:** Growth remained slow (averaging 2.5%), with emerging markets facing tighter financial conditions.\n\n### **Vision \u0026 Conclusion**\nThe Bank remains committed to its vision of becoming a **World-Class Commercial Bank by 2025**. The President attributed the year’s success to the loyalty of customers, the dedication of the 15,000+ employees, and the strategic leadership of the Board of Directors."
Consumer Price Index March 2025,13,"Here is a summary of the Inflation Report for March 2017 (EFY) issued by the Ethiopian Statistical Service:\n\n**General Inflation Trends**\n*   **Year-on-Year (Annual) Inflation:** The general inflation rate for March 2017 (EFY) stood at **13.6%**, a significant decrease from **26.2%** recorded in March 2016 (EFY). This indicates a downward trend in annual inflation.\n*   **Month-on-Month Inflation:** Compared to February 2017, the general price level increased by **2.7%** in March 2017.\n\n**Food vs. Non-Food Inflation (Year-on-Year)**\n*   **Food Inflation:** Registered at **11.9%** (down from 29.0% in March 2016). The increase was primarily driven by rising prices in:\n    *   Oils and Fats (36.3%)\n    *   Milk, Cheese, and Eggs (28.8%)\n    *   Fruits (26.7%)\n    *   Meat (17.8%)\n    *   Sugar, Jam, Honey, and Chocolate (13.4%)\n*   **Non-Food Inflation:** Registered at **16.2%** (down from 22.0% in March 2016). Key contributors included:\n    *   Transport (32.5%)\n    *   Education (23.3%)\n    *   Restaurants and Hotels (18.3%)\n    *   Housing, Water, Electricity, Gas, and Other Fuels (17.4%)\n\n**Monthly Price Changes (Month-on-Month)**\nIn March 2017, prices increased for both major categories compared to the previous month:\n*   **Food:** Prices rose by **3.2%**, driven by increases in Oils and Fats (7.5%), Food products n.e.c (6.4%), and Milk, Cheese, and Eggs (5.7%).\n*   **Non-Food:** Prices rose by **2.5%**, driven by increases in Restaurants and Hotels (4.7%), Health (6.4%), and Household Equipment (4.1%).\n\n**Long-Term Trends**\n*   **12-Month Moving Average:** The overall moving average inflation rate dropped to **17.9%** in March 2017, compared to 28.9% a year prior.\n*   **Historical Context:** The report notes that inflation had remained in double digits since 2010. The recent decline follows a period of high inflation (over 30% in 2014 and 2015) caused by factors such as COVID-19, internal conflict, and the Russia-Ukraine war. The current easing of inflation is partly attributed to tight monetary policy and credit reduction."
Security_Vulnerability_Disclosure_Standard_Procedure_1,16,"**Document Title:** Disclosure Standard Procedure Security Vulnerability\n**Organization:** Commercial Bank of Ethiopia (CBE)\n**Date:** February 2023\n\n### **Overview**\nThis document establishes the official rules and guidelines for security researchers and ethical hackers regarding the discovery and disclosure of vulnerabilities in CBE’s information systems. The goal is to protect the Bank's infrastructure while encouraging responsible reporting of security flaws.\n\n### **Key Sections**\n\n**1. Objective**\nThe procedure aims to set clear rules of engagement for identifying and submitting security vulnerabilities. It creates a framework for responsible communication and remediation of security weaknesses.\n\n**2. Scope**\n*   **In-Scope:** All internet-accessible and public-facing systems, including specific domains (e.g., `*.cbe.com.et`, `*.combanketh.et`), mobile banking apps, and internet banking services.\n*   **Out-of-Scope:**\n    *   Third-party hosted services or systems.\n    *   Physical security testing (e.g., tailgating, locks).\n    *   Social engineering (phishing, vishing).\n    *   Denial of Service (DoS/DDoS) attacks.\n    *   Volumetric testing that overwhelms services.\n    *   Reports on \\ (e.g., missing headers) or non-exploitable vulnerabilities.\n\n**3. Authorization and Legal Protection**\n*   Researchers must comply with Ethiopian law (specifically Computer Crime Prevention Proclamation No. 958/2016) and CBE policies.\n*   **Safe Harbor:** CBE guarantees that researchers acting in good faith and following this standard procedure will not face legal action. They will work with researchers to resolve issues rather than prosecute them.\n\n**4. Guidelines for Researchers**\n*   **Notify Immediately:** Report potential vulnerabilities as soon as they are discovered.\n*   **Avoid Harm:** Do not degrade user experience, destroy data, or disrupt production systems.\n*   **Data Privacy:** If sensitive data is found, stop testing immediately, do not exfiltrate the data, and notify CBE right away.\n*   **Non-Disclosure:** Do not publicly disclose the vulnerability until CBE has fixed it. A minimum of **120 working days** is requested for remediation.\n*   **Quality:** Do not submit high volumes of low-quality reports.\n\n**5. Testing Rules (Prohibited Actions)**\nResearchers must NOT:\n*   Test third-party applications or systems.\n*   Perform DoS/DDoS or physical attacks.\n*   Use social engineering techniques.\n*   Introduce malicious software or pivot to other systems.\n*   Exfiltrate data or establish persistent command-line access.\n\n**6. Reporting Process**\n*   **Contact:** Vulnerabilities should be reported to `cybersecurity@cbe.com.et`.\n*   **Format:** Reports should be in plain text, rich text, or HTML (English preferred).\n*   **Content:** Must include technical steps to reproduce the vulnerability, tools used, and screenshots or Proof-of-Concept (PoC) code. Executable files are not accepted.\n\n**7. CBE’s Commitment**\n*   **Acknowledgment:** CBE will acknowledge receipt within **5 business days**.\n*   **Resolution:** CBE will verify the vulnerability and keep the researcher updated on the remediation process.\n*   **No Bounty:** CBE does not offer financial rewards or recognition for submissions, but guarantees legal safety for compliant researchers.\n\n**8. Enforcement**\nViolation of this procedure may result in legal action under national cybercrime laws and CBE internal policies. The policy is effective as of the approval date and will be reviewed every two years."
